{
  "schemaVersion": 1,
  "materializationVersion": "legacy-taxonomy-materialization-v1",
  "phase4MaterializationManifestPayloadSha256": "72ba1b79b550bb8e15ed68dfaa81d2ae8e730784497a96d419b32417a9f39fcb",
  "rawInventoryManifestPayloadSha256": "306abbeaf9775e9a00efc4278f3841fa35a9e825d34c356a6ad902fe1d2cb522",
  "reviewPayloadSha256": "eaaa43c0c45786f545333de0af4aba4c2b6887cbb3b38167488364c9e097e64a",
  "taxonomyRegistryPayloadSha256": "5b2f4f6c3ad6748fccb92a1cb1cd9393f36d2b27d7adb693a3f4da921974479d",
  "records": [
    {
      "legacyContentId": "blog:2025-10-06",
      "targetPath": "apps/site/src/content/blog/2025-10-06.mdx",
      "phase4TargetFileSha256": "b2fe38baeb55df5ec052ef638d0392496ec780d6639555fbb8b51de1fd42cfeb",
      "finalTargetFileSha256": "5f3b8cf32fd7f85624cd0bee1c8595dd897aab543330009a0b83309368ca779e",
      "finalFrontmatterSha256": "8eb7e3f099f8eba827f1312f9a7af39e9f7a2f264d43c51a0d7be35ac19503a0",
      "categoryId": "infrastructure",
      "tagIds": [
        "conoha-vps",
        "network",
        "public-key-auth",
        "ssh",
        "vps",
        "web-server"
      ],
      "stackIds": [],
      "retiredRawTerms": [
        "programing",
        "初心者向け"
      ],
      "appliedRawTermCount": 8,
      "recordPayloadSha256": "c94a05d0c7dea5cd1360e2314994fd9ba8e162f8c638c12abba9af1ca218e101"
    },
    {
      "legacyContentId": "blog:anythingllm-fresh-thread-reembed-workspace",
      "targetPath": "apps/site/src/content/blog/anythingllm-fresh-thread-reembed-workspace.mdx",
      "phase4TargetFileSha256": "5bcb7b061ade44b89ef7ec312b8d4bb7439ed6a173bab86786ac928aeb6ad681",
      "finalTargetFileSha256": "e7ff2c56b63658dbecb65fa46d44f89fcef73e445197d153916ed6f5255fa4eb",
      "finalFrontmatterSha256": "63f2396839f2b2145418e2829f092af6cdcb2888f001a8aa6647d8bc65941b7f",
      "categoryId": "infrastructure",
      "tagIds": [
        "anythingllm",
        "qdrant",
        "rag",
        "vllm"
      ],
      "stackIds": [],
      "retiredRawTerms": [],
      "appliedRawTermCount": 4,
      "recordPayloadSha256": "d79f8ac065a97f7bc696a3065282d8a576b7ad30641fb85807ee9bde2ba98b76"
    },
    {
      "legacyContentId": "blog:anythingllm-vllm-followup-streaming-workaround",
      "targetPath": "apps/site/src/content/blog/anythingllm-vllm-followup-streaming-workaround.mdx",
      "phase4TargetFileSha256": "7457d33e09577ad5818e3211c6e38acf67221564b5624dd25da5b98115cfc154",
      "finalTargetFileSha256": "0a1027a8d8f8f37e17008064b3b780905ee0dd806f51f5de996ba48a02b39e20",
      "finalFrontmatterSha256": "5ff096c9494fbc1db95ce62a21a06f1a3cef83a4585aac489e89593c1563bb03",
      "categoryId": "infrastructure",
      "tagIds": [
        "anythingllm",
        "qwen",
        "rag",
        "troubleshooting",
        "vllm",
        "wsl"
      ],
      "stackIds": [],
      "retiredRawTerms": [],
      "appliedRawTermCount": 7,
      "recordPayloadSha256": "d78431e696dd7d4862be0f14139a939c52cd86e131fa9e3765c6ee41141e8e06"
    },
    {
      "legacyContentId": "blog:codex-sqlite-write-amplification-mitigation",
      "targetPath": "apps/site/src/content/blog/codex-sqlite-write-amplification-mitigation.mdx",
      "phase4TargetFileSha256": "79fafb151c10071779783e084a0ecfd12318bc84c2569a71f54f8f41203224ce",
      "finalTargetFileSha256": "8dec77081c6a4906a5d1eeada0eb4108a2c101c831f42ea4febace05cd0f0ec6",
      "finalFrontmatterSha256": "64b9955418eac3b755d921fecec0be814b2545d948cbb52ba2d77ee9d0c2f49e",
      "categoryId": "software",
      "tagIds": [
        "codex",
        "debugging",
        "performance",
        "sqlite",
        "ssd",
        "windows"
      ],
      "stackIds": [],
      "retiredRawTerms": [],
      "appliedRawTermCount": 7,
      "recordPayloadSha256": "50afdd486e116c4369200de294677a21c6c13052c50c032d1fc5fc28eedefe00"
    },
    {
      "legacyContentId": "blog:compacting-wsl-vhd-in-place-after-c-drive-move",
      "targetPath": "apps/site/src/content/blog/compacting-wsl-vhd-in-place-after-c-drive-move.mdx",
      "phase4TargetFileSha256": "3bfd86aa02f199e86fbbce4c304618253030228a2bbb220260e278720bfe6a49",
      "finalTargetFileSha256": "3a675778ff86064057c00ce49160e49ada95cb492ff6e9c7dd044483327210d3",
      "finalFrontmatterSha256": "4e99c150ef7906ed06c48e55b58da631aed4b7e7281ca01aa29119278f164f09",
      "categoryId": "infrastructure",
      "tagIds": [
        "homelab",
        "storage",
        "troubleshooting",
        "windows",
        "wsl"
      ],
      "stackIds": [],
      "retiredRawTerms": [],
      "appliedRawTermCount": 6,
      "recordPayloadSha256": "f802464917abfcf111a338517ef199133a3586519f9115ccbfdf12532c23dedd"
    },
    {
      "legacyContentId": "blog:gale-adaptive-conservative-planner",
      "targetPath": "apps/site/src/content/blog/gale-adaptive-conservative-planner.mdx",
      "phase4TargetFileSha256": "150ba426749c621f7ca051b044dac7a70c7955978a49c0c10463c6c79672102d",
      "finalTargetFileSha256": "2430bea2e08319631ee2d5b622845f688fe98c33cfd5a1b2603fae30215c2c9e",
      "finalFrontmatterSha256": "8a6ccf2342a84ccd48d82be3dd1ab05e1d2eaf0fab254ff341ffc248f8103aa4",
      "categoryId": "software",
      "tagIds": [
        "gale",
        "gpu",
        "performance",
        "planner",
        "rust",
        "search",
        "wgpu"
      ],
      "stackIds": [],
      "retiredRawTerms": [],
      "appliedRawTermCount": 8,
      "recordPayloadSha256": "de9b8ac722a799facb9473e12cfb288bce51a70c02d8a821934a68c63126b6c0"
    },
    {
      "legacyContentId": "blog:gale-adaptive-multi-run-review",
      "targetPath": "apps/site/src/content/blog/gale-adaptive-multi-run-review.mdx",
      "phase4TargetFileSha256": "160998aa1e5e14aabedfe0622df6eec59f3b59dc5487c45eb6f1a9076bd62cea",
      "finalTargetFileSha256": "89c3f786a45b0a011ad8e9609dd8ab803d9662cef90637dbec17c915e869be6c",
      "finalFrontmatterSha256": "f686185a31d01caf73f4cd169ccc27344487399674792040ed6a002eb9a36164",
      "categoryId": "software",
      "tagIds": [
        "gale",
        "gpu",
        "performance",
        "planner",
        "rust",
        "search",
        "telemetry",
        "wgpu"
      ],
      "stackIds": [],
      "retiredRawTerms": [],
      "appliedRawTermCount": 9,
      "recordPayloadSha256": "e2a9a9aa8dbf114e5a0a31d835d407c2b49ab798978ca9c950cf83664c7f48a1"
    },
    {
      "legacyContentId": "blog:gale-adaptive-planner-gpu-query-eligibility",
      "targetPath": "apps/site/src/content/blog/gale-adaptive-planner-gpu-query-eligibility.mdx",
      "phase4TargetFileSha256": "43beac1b6de97d89b4a7d2024e2a65d7edcc287ce6abc8a7c90c7a0e7ece1362",
      "finalTargetFileSha256": "27f50203f274d3ba1a96a75a6a5ee094a820de68d6ae880ec3328ac7fbbecddc",
      "finalFrontmatterSha256": "e5cff7675fc2c61ea29ed045f4d77526a98d7eafe424a17a7e0164d053d04438",
      "categoryId": "software",
      "tagIds": [
        "gale",
        "gpu",
        "planner",
        "regex",
        "rust"
      ],
      "stackIds": [],
      "retiredRawTerms": [],
      "appliedRawTermCount": 6,
      "recordPayloadSha256": "87488d04b373096278456dbc178dd052d4993daef242d49d196ddd9e66c32c06"
    },
    {
      "legacyContentId": "blog:gale-adaptive-review-checklist",
      "targetPath": "apps/site/src/content/blog/gale-adaptive-review-checklist.mdx",
      "phase4TargetFileSha256": "69dccffe763cc17dcef020c07b85a866e22cb5d5c232f871106ba5c24ac8c8d5",
      "finalTargetFileSha256": "c79937ef120d1554f4c1b875b8905613e0bc621050d915dc059a9c5d4dca19fe",
      "finalFrontmatterSha256": "aa7cb9e23cddb234d05745708861dfbb89fd827a0a29de4695d0c4fe5859a7f2",
      "categoryId": "software",
      "tagIds": [
        "gale",
        "gpu",
        "performance",
        "planner",
        "rust",
        "search",
        "telemetry",
        "wgpu"
      ],
      "stackIds": [],
      "retiredRawTerms": [],
      "appliedRawTermCount": 9,
      "recordPayloadSha256": "b1acb00a15f8a3c467ca53f94be311be799343996279a3b3010a58452b98c446"
    },
    {
      "legacyContentId": "blog:gale-adaptive-rule-governance",
      "targetPath": "apps/site/src/content/blog/gale-adaptive-rule-governance.mdx",
      "phase4TargetFileSha256": "14572a6fb1440edfda16e5342efbec4f3d9bcbebfc1de3611b84755496d0cd39",
      "finalTargetFileSha256": "bad770d2a81834ee979172ff5ef3a2ae73cfae4ce9ff807a4bc6460f9460dc16",
      "finalFrontmatterSha256": "4bfcb45a05db56321d64ef72ec5d695da52d630e47c6395f8d843e1318f84336",
      "categoryId": "software",
      "tagIds": [
        "gale",
        "gpu",
        "performance",
        "planner",
        "rust",
        "search",
        "telemetry",
        "wgpu"
      ],
      "stackIds": [],
      "retiredRawTerms": [],
      "appliedRawTermCount": 9,
      "recordPayloadSha256": "49769e3f156751894b59f6fc939d5d4957cab849ef8f26f018d89b4d3a8259c1"
    },
    {
      "legacyContentId": "blog:gale-adaptive-rule-promotion-gate",
      "targetPath": "apps/site/src/content/blog/gale-adaptive-rule-promotion-gate.mdx",
      "phase4TargetFileSha256": "1b96677105c361509537ae9158a963fd2184b3b110c5a2ce3c5887af1c162941",
      "finalTargetFileSha256": "2d5aba15da863738bb707e94e88a0ce6025a6fd9cc17a0d53143e7f566f8e445",
      "finalFrontmatterSha256": "a933f7a190cc0dd071dcb94c59215b4fb09ba398901552632619bdd8010b1091",
      "categoryId": "software",
      "tagIds": [
        "gale",
        "gpu",
        "performance",
        "planner",
        "rust",
        "search",
        "telemetry",
        "wgpu"
      ],
      "stackIds": [],
      "retiredRawTerms": [],
      "appliedRawTermCount": 9,
      "recordPayloadSha256": "a9157d80ec260e74b256c8c2fbe0d73245eb640cb39458a1ccc6a4e5adb30f18"
    },
    {
      "legacyContentId": "blog:gale-adaptive-rule-table",
      "targetPath": "apps/site/src/content/blog/gale-adaptive-rule-table.mdx",
      "phase4TargetFileSha256": "5b9bf25be1ec93125c17267816cdfa6728cb9572cbbcf7cc6cc7a5189b57c05f",